SR.No.,Company Name,Founder,Sectors,Funded,Invested,Target,Investor,Equity,Days left,Progress,Location,Tax Relife,Likes,Tweets,Share,Content,Photo Url
"1","Information Works London ","","","5%","£10,160","£200,000 ","8","10.00%","38"," 8%","Hartham Park, Corsham, Wiltshire","EIS,","0","0","0","Information Works are a one-stop Direct Marketing solution allowing clients to select individuals at over 27 million household addresses, creating personalised mailings and aim to send them to print and post within minutes. Read full pitch","http://www.crowdcube.com/files/pitch_pics/thumbs/200x150/2/1_0854108b56e5ef1cf231a82aceb2eb67.jpg"
"2","Bootstrap Responsive Themes ","","","3%","£2,090","£60,000 ","9","20.00%","58"," 8%","Merton, London","SEIS,","9","4","0","Bootstrap Responsive Themes is a soon to be launched online marketplace centred around the buying and selling of website themes that are based on the Bootstrap web development framework. We consider that mobile internet users expect a web-browsing experience on their phone that's comparable to what they get on their desktop or laptop. Read full pitch","http://www.crowdcube.com/files/pitch_pics/thumbs/200x150/2/1_6e356c142588460f1c44c5c4555c57f9.jpg"
"3","Clear Water Revival ","","","50%","£80,350","£160,000 ","46","10.00%","17"," 50%","Bristol, City of Bristol","EIS,","10","21","5","Clear Water Revival have been successfully designing and constructing chlorine free, natural swimming pools since 2006. They have developed a biological filtration technology that uses nature's processes, not chemicals to clean and sanitise swimming pool water. Their product aims to become the filtration system of choice in the swimming pool market. Read full pitch","http://www.crowdcube.com/files/pitch_pics/thumbs/200x150/2/1_046c106479765544096da8f48822cf7f.jpg"
"4","Givey ","","","1%","£6,490","£500,000 ","35","18.50%","43"," 6%","Newcastle","EIS,","10","49","3","Givey is an instant donation matching platform. They aim to make it fun and easy for people to find and support causes they care about and easy for businesses to back their customers and employees. Read full pitch","http://www.crowdcube.com/files/pitch_pics/thumbs/200x150/2/1_708b0ea6f900fb59b4408000e1d67fb7.jpg"
"5","Blanco Nino ","","","43%","£26,090","£60,000 ","28","6.64%","46"," 43%","Islington, London","EIS,SEIS","225","11","13","Blanco Niño, working directly with Irish farmers, aims to establish an authentic corn tortilla factory in Dublin Ireland. Producing unadulterated and sustainably produced corn tortillas, tortilla chips and masa haina for the European market.Read full pitch","http://www.crowdcube.com/files/pitch_pics/thumbs/200x150/2/1_06e20d11cfb80dfe53b427640b704914.jpg"
"6","Seeme ","","","60%","£12,040","£20,000 ","19","20.00%","32"," 60%","Manchester","EIS,SEIS","1","2","1","Seeme is a website created to help facilitate the sharing and organisation of teaching resource and ideas to provide a high quality resource database, alongside a social network.The website provides a platform for teachers to submit and share resources and ideas and to interact with each other on multiple levels. It will give teachers an opportunity to showcase their work and they will be rewarded for submitting high quality resources. Read full pitch","http://www.crowdcube.com/files/pitch_pics/thumbs/200x150/2/1_51471f2c553b915d544fe40800468bbd.jpg"
"7","Zero Carbon Food ","","","81%","£243,100","£300,000 ","239","15.00%","22"," 81%","Wandsworth, London","EIS,","112","84","13","Backed by celebrity chef Michel Roux Jr and Florette’s Managing Director, Zero Carbon Food utilizes redundant underground spaces in London, producing leafy greens, herbs and micro greens using LED lights and hydroponics, producing fresh ingredients with a minimal carbon footprint. Read full pitch","http://www.crowdcube.com/files/pitch_pics/thumbs/200x150/2/1_fabe25f815ed604b3086479afb026d93.jpg"
"8","Artisan Burger Company ","","","26%","£39,220","£150,000 ","18","15.00%","17"," 26%","Kinfauns, Perth and Kinross","SEIS,","6","43","13","Artisan Burger Company plans to open a chain of restaurants, which offer handmade gourmet Beef Burgers, hand cured Salt Beef and slow cooked Pulled Pork burgers combined with craft beer and artisan cider. Read full pitch","http://www.crowdcube.com/files/pitch_pics/thumbs/200x150/2/1_21f7d44641727bfd84484900372d3063.jpg"
"9","Crumpet Cashmere ","","","114%","£85,720","£75,000 ","52","10.00%","47"," 100%","Colchester, Essex","EIS,","20","3","1","Crumpet is a niche luxury fashion brand recognised in the fashion industry and now looking to grow its online retail platform and customer base. Offering distinctive, desirable cashmere knitwear, the brand is looking to become a leading player in the retail market capitalising on the growth of the affordable luxury market . Worn by celebrities such as Pippa Middleton , Elle McPhersonand Alexa Chung. Read full pitch","http://www.crowdcube.com/files/pitch_pics/thumbs/200x150/2/1_888d5dd544f291ebcad78a00a223c795.jpg"
"10","Stacking Systems ","","","33%","£27,030","£80,000 ","20","10.00%","39"," 33%","Wolverhampton","SEIS,","2","1","0","Pallet Eater hopes to fulfil a universal need for an easier, more efficient and more mobile means of collating and stacking empty pallets. It stacks up to five times faster than a forklift. Pallet Eater also stacks squarely and is completely mobile. In addition, it can strap each column, all packed up and ready for re-use. Read full pitch","http://www.crowdcube.com/files/pitch_pics/thumbs/200x150/2/1_caef7493304aff04d4883ad3d347d191.jpg"
"11","Innovative Vehicle Systems Limited ","","","7%","£7,150","£100,000 ","12","8.00%","39"," 10%","Wareham, Dorset","EIS,SEIS","0","8","0","The IVSL team is passionate about reducing the death toll on our roads.They have built an advanced technical demonstrator of a vehicle collision warning system that works in real time. They have generated keen interest in their system from all over Europe . This has given them an overwhelming sense of belief that they are on the right track to achieve their goal of supplying low cost systems, to a very substantial global market.Read full pitch","http://www.crowdcube.com/files/pitch_pics/thumbs/200x150/2/1_d62e7dfee8a121857fba1c61a1a9517d.jpg"
"12","Thor Drinks","","","5%","£4,650","£85,000 ","17","10.00%","52"," 8%","Enfield, London","EIS,SEIS","11","42","6"," Thor Drinks is a new range offering legendary refreshment to adults in bars, pubs and restaurants. We believe thatsweet and sickly soft drinks are monopolising the bar back fridges, and that Thor Drinks are challenging the old guard by capturing what we enjoy most in our favourite alcohol brands - crisp, dry flavours delivered with drama and passion.Read full pitch","http://www.crowdcube.com/files/pitch_pics/thumbs/200x150/2/1_80e0db01dab7fa260f86cde03b24a9c6.jpg"
"13","One City ","","","115%","£80,960","£70,000 ","140","5.00%","23"," 100%","Henley-On-Thames, Oxfordshire","-,","13","111","10","One City is an online and offline gateway to an estimated £12bn+ global flexible workspace industry. 48% of us work remotely for at least half the week. One City aims to provide a global network of inspiring workplaces, allowing work anytime, anyplace, anywhere – online and offline.And you only pay for what you use. Property owners can participate in a global franchise with a digital platform and employers can reduce their property overheads through mobile working. Read full pitch","http://www.crowdcube.com/files/pitch_pics/thumbs/200x150/1/1_5323216c7c5b52f2d0e97ede0507bfee.jpg"
"14","Gift Wrapped & Gorgeous ","","","3%","£1,550","£50,000 ","13","10.00%","2"," 8%","Bodmin, Cornwall","EIS,","84","121","3","Gift Wrapped & Gorgeous brings together people looking for beautiful gifts, home ware and jewellery, and the work of the UK's designer makers and creative businesses.They carefully handpick small creative businesses to showcase and sell a selection of UK designed lifestyle products and gift ideas for any gift occasion. Read full pitch","http://www.crowdcube.com/files/pitch_pics/thumbs/200x150/2/1_295cd590034ee7962194851fa9bf88f1.jpg"
"15","STS Yacht Services ","","","5%","£1,340","£25,000 ","10","7.15%","6"," 8%","Plymouth, Devon","EIS,SEIS","0","1","1","STS Yacht Services provides bespoke supply of high end 'below deck' items, such as flatware, stemware, dinnerware, bedding, crew uniforms etc. for superyachts. They offer an online catalogue where the user browses and selects items that they are interested in purchasing. STS then takes samples of these items to the boat in order to give the client the opportunity to experience and compare these items in their intended environment, prior to purchase. Read full pitch","http://www.crowdcube.com/files/pitch_pics/thumbs/200x150/2/1_ff1044b681d60873ad8b5f5fdf93df51.jpg"
"16","Solar 350 ","","","6%","£7,780","£125,000 ","11","10.39%","56"," 10%","City of Westminster, London","EIS,SEIS","3","6","1","Solar 350 is a developer of large scale solar parks in locations that are deemed most suitable to the technology to generate the best possible financial returns. This is based on high levels of solar irradiation, electricity prices and levels of subsidy along with low land, labour and development costs. Solar 350 aims to provide the most Commercial Solutions to Climate Change. Read full pitch","http://www.crowdcube.com/files/pitch_pics/thumbs/200x150/2/1_674a6e58fba65fc28d3af3554b4d5cee.jpg"
"17","TAXMAP ","","","3%","£1,750","£50,000 ","7","10.00%","45"," 8%","City of Westminster, London","SEIS,","19","570","49","Our mission is to organise the world's tax information and to make it universally accessible and useful. Our goal is to save time and money and to create simplicity, neutrality, transparency, and stability in presenting tax information. Read full pitch","http://www.crowdcube.com/files/pitch_pics/thumbs/200x150/2/1_17a847565ce8d416e471da8c1aaa7df4.jpg"
"18","Pooltronix Holdings ","","","3%","£5,810","£150,000 ","8","32.00%","39"," 8%","Ventnor, Isle of Wight","EIS,SEIS","0","0","0","Pooltronix Holdings Limited has designed a potentially game changing technology, the E-system, to sanitise public and commercial swimming pools, spa /Jacuzzis without the use of any chemicals. Read full pitch","http://www.crowdcube.com/files/pitch_pics/thumbs/200x150/2/1_8af557f2473160630fbcd4c4cbbac62c.jpg"
"20","TouristHop ","","","23%","£15,270","£64,000 ","8","15.24%","15"," 23%","Gillingham, Medway","EIS,SEIS","13","0","0","TouristHop is a website which provides users with the ability to compare local tourist activity service providers. The platform will begin as an intuitive interactive map to allow simple comparisons. Initially launching in Tenerife. With funding TouristHop will expand globally. Read full pitch","http://www.crowdcube.com/files/pitch_pics/thumbs/200x150/2/1_8d5076a794b3c694d2272b1fc3fa4e06.jpg"
"21","Best of All Worlds ","","","43%","£86,370","£200,000 ","22","7.40%","29"," 43%","Stockholm, Sweden","-,","7","1","0","BOAW aims to be the ultimate discovery and matching platform for people, products and services online. Created with the aim of enabling its members to navigate and leverage the relevant collective intelligence of the ‘trusted’ few. By segmenting and matching niche interests and backgrounds, it provides an intimate and private web environment with the aim of targeting top global influencers and connectors who share common backgrounds, interests and passions. Read full pitch","http://www.crowdcube.com/files/pitch_pics/thumbs/200x150/2/1_0d3f793c0b1dcec934782e38e73a9564.jpg"
"22","The New Craftsmen ","","","19%","£29,870","£150,000 ","22","5.40%","31"," 19%","Mayfair, London","EIS,","26","37","6","The New Craftsmen offers a range of high quality hand-crafted products made in Britain.They intend to create a business and a brand in a sector which, whilst currently disorganised and lacking in high quality retail outlets, is worth in excess of £883m in England alone. They focus on the top end - placing craft into the luxury sector.They have now traded for just over twelve months - giving them invaluable experience. Read full pitch","http://www.crowdcube.com/files/pitch_pics/thumbs/200x150/2/1_00e07e9d1b177104d39a61d51c3adf73.jpg"
"23","BodyFire ","","","33%","£66,230","£200,000 ","30","10.00%","20"," 33%","Warfield, Bracknell, Bracknell Forest","EIS,SEIS","46","95","1","BodyFire is a Fitness and Nutrition business comprising a number of fitness, supplement and nutrition products,developed and created by England Rugby player James Haskell and his team. The BodyFire product range of all naturalproducts, includes the award winning Men’s pre-training supplement Hades. BodyFire also owns its own YouTube TV channel, Angry Squirrel coffee brand and is in the process of opening its first Gym. Read full pitch","http://www.crowdcube.com/files/pitch_pics/thumbs/200x150/2/1_524351b42bdbda77468afc0548fe608f.jpg"
"24","Hewitt Banks ","","","1%","£2,020","£150,000 ","3","25.00%","51"," 6%","Wakefield, West Yorkshire","SEIS,","0","0","3","Hewitt Banks is a UK based recruitment consultancy specialising in placing professional candidates into Permanent, Contract, Temporary and Interim positions in a variety of sectors.Read full pitch","http://www.crowdcube.com/files/pitch_pics/thumbs/200x150/2/1_ac636f0460b3563dc65ad55bcc544f31.jpg"
"25","Projects Host ","","","50%","£50,720","£100,000 ","17","11.00%","1"," 50%","Oldbury, West Midlands","EIS,","5","16","0","Projects Host is an internet solutions provider and has developed a Cloud-based biometric authentication for online transactions and payments on Smartphones and tablets. The launch of this technology aims to capitalise on the adoption of the Biometric Solution for financial transactions, with the mission of increasing the safety and security of online banking and payment against fraud. Read full pitch","http://www.crowdcube.com/files/pitch_pics/thumbs/200x150/2/1_7e224849c811fcdf4ddd00854c485937.jpg"
"26","Bristol Spaceplanes ","","","2%","£3,670","£150,000 ","20","5.00%","32"," 6%","Almondsbury, South Gloucestershire","EIS,","18","33","2","BRISTOL SPACEPLANES, aims to develop rocket-powered aeroplanes that can provide an 'airline' service to orbit with the vision of bringing low-cost access to space and space tourism from a long-term vision to a serious short-term prospect. Read full pitch","http://www.crowdcube.com/files/pitch_pics/thumbs/200x150/2/1_179c8e939b6d347b924940d3c5c459cb.jpg"
"27","KoppiT ","","","6%","£1,660","£25,000 ","8","10.00%","13"," 10%","Charter Alley, Hampshire","SEIS,","18","8","0","KoppiT turns the current e-commerce model on its head. Usually e-commerce users have to find the sellers of the items they want, whereas KoppiT invites the sellers to find the buyers. Its goal is to use the Internet’s reach to enable the vast global community of collectors, hobbyists and enthusiasts, who all share a passion for their specific interest to interact, trade and socialise. Read full pitch","http://www.crowdcube.com/files/pitch_pics/thumbs/200x150/2/1_e4f916a434c74ac63e6a3cb3a2bd0394.jpg"
"28","GolfProConnect ","","","1%","£260","£100,000 ","6","18.00%","45"," 6%","Liverpool, Merseyside","SEIS,","1","2","2","GolfProConnect aims to create the world’s largest online interactive golfing community. GPC’s innovative platform connects the modern golf market with real world business functionality. Golf is a $69 billion industrywith 56,000+P.G.A professionalsand 60 Million amateur golfersworldwide.GPC aims to be the worldwide market place for golfers to interact and do business. Read full pitch","http://www.crowdcube.com/files/pitch_pics/thumbs/200x150/2/1_e87f709c1e0ae3b697b3b4e26837bc10.jpg"
"29","Zeevon ","","","28%","£28,660","£100,000 ","25","13.33%","14"," 28%","Lambeth, London","EIS,SEIS","0","0","0","Zeevon.com is a multi-channel (online-instore-mobile) cycling and triathlon store with the aim of offering premier brands at value for money prices. It is an online destination to buy sports clothing, accessories and bikes. It markets throughout the UK and parts of Europe. Our customers are the worldwide cycling and triathlon community. Read full pitch","http://www.crowdcube.com/files/pitch_pics/thumbs/200x150/2/1_2dc98ac888b739eb4f8f9a9c77e482b0.jpg"
"30","Order a Taxi ","","","10%","£5,250","£50,000 ","11","5.00%","46"," 10%","Nottingham","EIS,SEIS","1","1","0","Order a Taxi is a mobile app service provider for taxi firms. We provide taxi firms with a full a mobile app presence for FREE and generate them an additional income stream as well as generating ourselves a commission. Our system uses the latest technologies to deliver GPS tracking, payment systems, and visually impressive full service mobile apps. An innovative, exciting, scalable business model with pre sign ups in a market worth over £4.3bn year. Read full pitch","http://www.crowdcube.com/files/pitch_pics/thumbs/200x150/2/1_473ab0ddbd4906c6c94fcea7070c6ccb.jpg"
"31","Yeezey ","","","5%","£3,590","£60,000 ","10","7.90%","9"," 8%","Islington, London","EIS,SEIS","14","3","4","Yeezey is a city-based website and mobile application that connects local customers and retailers. It plans to become the platform of choice for retailers looking to organise sales events online and an opportunity for buyers in search of local discovery and discounts.Read full pitch","http://www.crowdcube.com/files/pitch_pics/thumbs/200x150/2/1_14e5b9285e7748aff098512ef166f8b3.jpg"
"32","BUY2LET ","","","3%","£5,650","£150,000 ","7","25.00%","25"," 8%","Lymington, Hampshire","SEIS,","0","8","0","We aim for BUY2LET.com to become what we believe will be the UK's first property web site dedicated solely to the listing for sale of residential investments. We plan for functionality to include features such as annual return or yields as additional search criterias to location,type,size and price. Read full pitch","http://www.crowdcube.com/files/pitch_pics/thumbs/200x150/2/1_8e696d42450783afb6d6f8c332f613ad.jpg"
"33","Music Practiced Perfectly ","","","2%","£4,340","£150,000 ","16","25.00%","17"," 6%","Burntwood, Staffordshire","EIS,","0","6","0","As an E-Commerce business, Guitar Practiced Perfectly plans to open up a new and exciting experience for those who are new to the guitar, or more experienced players who want to develop their playing further. With a new educational module, the business is to expand with multi languages and plans to penetrate the Chinese and Indian markets. Music Practiced Perfectly also plan to introduce other instruments opening up an even larger market across the world. Read full pitch","http://www.crowdcube.com/files/pitch_pics/thumbs/200x150/2/1_33c20649e83494012948c48f322b4836.jpg"
"34","Beach Road Design ","","","1%","£410","£35,000 ","12","7.50%","14"," 6%","Portishead, North Somerset","EIS,","0","7","0","We believe that we have created a contemporary and intricately designed kitchen dish drainer that aspires to visually enhance a kitchen space. The aim of Asinka’s design is to enable the drip tray to send drained water back in to a sink unit which allows the item to stand directly on work surfaces in the absence of a draining board. This should allow plates, cutlery, glassware or delicate items to be stacked alongside pans or larger cookware. Read full pitch","http://www.crowdcube.com/files/pitch_pics/thumbs/200x150/2/1_d477bfc658090b8c8d90d4093c455378.jpg"
"35","Emozioni Food ","","","1%","£110","£75,000 ","2","15.00%","28"," 6%","City of Westminster, London","EIS,SEIS","2","1","0","Emozioni is a luxury and innovative Italian specialty foods company and it is our aim to represent the epitome of Italian culture  style, passion and quality with a modern twist. The food brand is influenced by luxury modern art and fashion. Read full pitch","http://www.crowdcube.com/files/pitch_pics/thumbs/200x150/2/1_1a3ac3db1803b1f81e0e13318f277da5.jpg"
"36","Exertus Jobs ","","","0%","£0","£100,000 ","0","7.50%","52"," 0%","Ipswich, Suffolk","EIS,","0","0","0","Exertus Jobs is a niche online job board dedicated to providing experienced job seekers with a variety of employers for full, part, temporary and contract opportunities. Exertus Jobs aims to become the premier specialised online job board site for older workers and employers recruiting for experienced, mature and seasoned individuals Read full pitch","http://www.crowdcube.com/files/pitch_pics/thumbs/200x150/2/1_d19b9273bd5d168287c4ccd1892687bd.jpg"
