SR.No.,Company Name,Founder,Sectors,Funded,Invested,Target,Investor,Equity,Days left,Progress,Location,Tax Relife,Likes,Tweets,Share,Content,Photo Url
"46","Webinact ","","","8%","£12,870","£150,000 ","","","39"," 10%","Southwark, London","SEIS,","0","2","0","Webinact’s mission is to bring live, broadcast-quality TV production to clients globally, at a fraction of conventional costs. The company operates “Studiobots”, compact facilities which can be installed anywhere but controlled centrally in London. Clients can use the service for conventional programs, investor communications, sales, training – for really impactful webinars. See Webinact in action 10am-midday daily: www.tiptv.co.uk Read full pitch","http://www.crowdcube.com/files/pitch_pics/thumbs/200x150/2/1_158f79e963a409a9b0e46e6a10bfcc5c.jpg"
"47","Dassie ","","","1%","£400","£100,000 ","","","40"," 6%","Tunbridge Wells, Kent","EIS,SEIS","0","0","0","Dassie is an artisan product range of home-ware and gifts handcrafted in the developing world. Dassie enters the market to fill the perceived void of eco-friendly home decor and gifts that are relevant within contemporary home-ware trends and project an ethical and sustainable ethos. Read full pitch","http://www.crowdcube.com/files/pitch_pics/thumbs/200x150/2/1_8ffb2605f56169f11d119a8713f81b73.jpg"
"48","Best of All Worlds ","","","49%","£99,570","£200,000 ","","","18"," 49%","Stockholm, Sweden","-,","8","1","2","BOAW aims to be the ultimate discovery and matching platform for people, products and services online. Created with the aim of enabling its members to navigate and leverage the relevant collective intelligence of the ‘trusted’ few. By segmenting and matching niche interests and backgrounds, it provides an intimate and private web environment with the aim of targeting top global influencers and connectors who share common backgrounds, interests and passions. Read full pitch","http://www.crowdcube.com/files/pitch_pics/thumbs/200x150/2/1_0d3f793c0b1dcec934782e38e73a9564.jpg"
"49","Bootstrap Responsive Themes ","","","4%","£2,710","£60,000 ","","","17"," 8%","Merton, London","EIS,SEIS","19","4","0","Bootstrap Responsive Themes is a soon to be launched online marketplace centred around the buying and selling of website themes that are based on the Bootstrap web development framework. We consider that mobile internet users expect a web-browsing experience on their phone that's comparable to what they get on their desktop or laptop. Read full pitch","http://www.crowdcube.com/files/pitch_pics/thumbs/200x150/2/1_6e356c142588460f1c44c5c4555c57f9.jpg"
"50","Hewitt Banks ","","","2%","£3,020","£150,000 ","","","10"," 6%","Wakefield, West Yorkshire","SEIS,","0","0","3","Hewitt Banks is a UK based recruitment consultancy specialising in placing professional candidates into Permanent, Contract, Temporary and Interim positions in a variety of sectors.Read full pitch","http://www.crowdcube.com/files/pitch_pics/thumbs/200x150/2/1_ac636f0460b3563dc65ad55bcc544f31.jpg"
