SR.No.,Company Name,Founder,Sectors,Funded,Invested,Target,Investor,Equity,Days left,Progress,Location,Tax Relife,Likes,Tweets,Share,Content,Photo Url
"1","Cahootify ","","","1%","£1,500","£105,000 ","","","59"," 6%","Bath, Somerset","EIS,SEIS","0","0","0","Cahootify is the social recruitment platform for freelancers, project leaders and employers in the fast-evolving world of work. Their mission is to become a leading online talent acquisition and management platform - and the leading platform worldwide for sourcing or joining dynamic, flexible project teams, no matter how “commercial” or “social” those projects are. Cahootify - love work more! Read full pitch","http://www.crowdcube.com/files/pitch_pics/thumbs/200x150/2/1_a4d24b8d4a68a03a6209208b6f734724.jpg"
"2","Givey ","","","10%","£52,500","£500,000 ","","","2"," 10%","Newcastle","EIS,","18","55","27","Givey is an instant donation matching platform. They aim to make it fun and easy for people to find and support causes they care about and easy for businesses to back their customers and employees. Read full pitch","http://www.crowdcube.com/files/pitch_pics/thumbs/200x150/2/1_708b0ea6f900fb59b4408000e1d67fb7.jpg"
"3","LocalPropertyIndex ","","","73%","£219,590","£300,000 ","","","52"," 73%","Chandler's Ford, Eastleigh, Hampshire","EIS,","0","1","2","LocalPropertyIndex.com is a venture capital backed property advertising web site targeting estate agents who need to advertise properties. Unlike their competitors, who charge a fixed monthly advertising fee, LPI's clients can advertise free of charge and only pay if they receive enquires from potential buyers/renters. The team has 8 years experience operating property portals and the CEO listed his previous business on the London Stock Exchange Read full pitch","http://www.crowdcube.com/files/pitch_pics/thumbs/200x150/2/1_62ebcc49f4c5a146e555d997a07151ef.jpg"
"4","AccountsDirect 24-7 ","","","1%","£110","£150,000 ","","","57"," 6%","City of Westminster, London","-,","16","0","0","Using cloud computing AD 24-7 has developed accountancy and document management software, taking advantage of cost efficiencies by using a Datacentre based in India, thus aiming to produce SME accounts at a fraction of fees that UK high street accountants charge. Read full pitch","http://www.crowdcube.com/files/pitch_pics/thumbs/200x150/2/1_69f50bafaccdda971ae1732c24e3945e.jpg"
"5","Stacking Systems ","","","105%","£84,140","£80,000 ","","","12"," 100%","Wolverhampton","SEIS,","3","2","6","Pallet Eater hopes to fulfil a universal need for an easier, more efficient and more mobile means of collating and stacking empty pallets. It stacks up to five times faster than a forklift. Pallet Eater also stacks squarely and is completely mobile. In addition, it can strap each column, all packed up and ready for re-use. Read full pitch","http://www.crowdcube.com/files/pitch_pics/thumbs/200x150/2/1_caef7493304aff04d4883ad3d347d191.jpg"
"6","Orsto ","","","42%","£25,580","£60,000 ","","","58"," 42%","Durham, County Durham","EIS,SEIS","0","1","0","Orsto Ltd is a UK design engineering business established by design engineer Paul Gill. Orsto Smartwatch R&D has been a 3 1/2 project. Latest Smartwatch market predictions are $9 Billion by 2018. The large mobile manufacturers are producing 'accessory' SmartWatches, however, Orsto have specialised in developing smart, desirable luxury 'stand-alone' Smartwatches. A fully functioning high end Smartphone on your wrist. Read full pitch","http://www.crowdcube.com/files/pitch_pics/thumbs/200x150/2/1_c9b4ba9139c3d7503c8960424e8d255d.jpg"
"7","Chupamobile ","","","67%","£271,990","£400,000 ","","","42"," 67%","City of Westminster, London","EIS,","45","15","21","Chupamobile allows people to buy professional Apps and Games, such as the hit app ‘Flappy Bird’, built by Mobile App Developers, ready to be customised and distributed on the App Store. They have already taken over £200,000 through licensing in the first 3 months of 2014 – over 100% of the total 2013 revenue. Read full pitch","http://www.crowdcube.com/files/pitch_pics/thumbs/200x150/2/1_5b2811dda00fef061dbc0bec1f3d28e6.jpg"
"8","UP Investments - The Crowdfunding Hub ","","","85%","£85,740","£100,000 ","","","31"," 85%","Bristol, City of Bristol","EIS,SEIS","7","53","2","UP is looking to unify the crowdfunding market by creating a centralised hub, designed for investors. In a potentially fragmented marketplace, UP plans to simplify crowdfunding by hosting investment opportunities, from across the market, on one site. Read full pitch","http://www.crowdcube.com/files/pitch_pics/thumbs/200x150/2/1_082785d21f72c773e6e41535ea2878ed.jpg"
"9","Just Right Products UK & Europe ","","","1%","£2,320","£400,000 ","","","40"," 6%","Frome, Somerset","EIS,","562","587","15","Just Right Products UK & Europe Limited have the Exclusive rights to Import, distribute, sell and market the Super Rope Cinch. This is a fully patented product with patents passed in the USA, and patents pending worldwide. Read full pitch","http://www.crowdcube.com/files/pitch_pics/thumbs/200x150/2/1_c4c4934d90d5d59ba6143bc07d6c2652.jpg"
"10","TAXMAP ","","","6%","£3,100","£50,000 ","","","4"," 10%","City of Westminster, London","SEIS,","26","573","49","The Taxmap mission is to organise the world's tax information and to make it universally accessible and useful. Their goal is to save time and money and to create simplicity, neutrality, transparency, and stability in presenting tax information. Read full pitch","http://www.crowdcube.com/files/pitch_pics/thumbs/200x150/2/1_17a847565ce8d416e471da8c1aaa7df4.jpg"
"11","SpottinStyle ","","","29%","£29,440","£100,000 ","","","39"," 29%","Islington, London","SEIS,","64","7","0","SpottinStyle aims to give the power back to the people to decide what is stylish to wear by simply spotting styles as they see them. SpottinStyle has ambition to create new style trends daily and at the same time create numerous opportunities to shop. Read full pitch","http://www.crowdcube.com/files/pitch_pics/thumbs/200x150/2/1_8beb904b4da2ce12187f765f168bd46e.jpg"
"12","MiThought ","","","40%","£36,150","£90,000 ","","","43"," 40%","Hounslow, London","EIS,SEIS","33","3","22","An early stage on-line global incubator where members post, share, develop ideas, collaborate, find partners and funding. MiThought aims to do for innovation and commercial connections what LinkedIn has done for recruitment and professional connections. Read full pitch","http://www.crowdcube.com/files/pitch_pics/thumbs/200x150/2/1_fe2e9509ae98391c57a5a6c812d4beeb.jpg"
"13","Ascendia Corporation ","","","13%","£13,970","£100,000 ","","","24"," 13%","Maidstone, Kent","-,","34","13","0","Ascendia Vehicle hire is a vehicle hire company with a difference  their business model allows customers to hire desirable, top specification performance vehicles for the price customers would usually pay to hire a standard vehicle elsewhere . Ascendia’s aim is to be the preferred vehicle hire company in the UK and eventually worldwide catering for all types of occasions. Read full pitch","http://www.crowdcube.com/files/pitch_pics/thumbs/200x150/2/1_6eb2528ac2393619399c3cf4bf9c5eff.jpg"
"14","Rib Club Global ","","","102%","£153,500","£150,000 ","","","19"," 100%","Chalkhouse Green, Reading, Oxfordshire","EIS,","9","0","0","Rib Club Global is a new concept offering boating experiences for everyone. Rib Club Global offer its members all the advantages of boating but takes out most of the cost and responsibility associated with owning and chartering boats. On a one-off yearly payment, members are awarded points which can be exchanged for days out in the rigid inflatable boats (RIBS). Rib Club Global intends to have various locations throughout the world. Read full pitch","http://www.crowdcube.com/files/pitch_pics/thumbs/200x150/2/1_c961eb956cbdd021cdec8c899cb70f21.jpg"
"15","BarMate ","","","1%","£1,980","£350,000 ","","","43"," 6%","Cockfosters, Barnet, Greater London","EIS,","15","1","0","The Barmate system allows guests relaxing by the pool and/or beach to request waiter service at the press of a button. Proprietary location technology locates the guest and alerts a waiter via a handheld tablet. BarMate are in advanced discussions to develop strategic partnerships with Hyatt, Melia and Starwood and are installed in 8 major 5* hotels in the Canaries and Florida. Read full pitch","http://www.crowdcube.com/files/pitch_pics/thumbs/200x150/2/1_61c57647a805520af19df62a2e56eb39.jpg"
"16","Order a Taxi ","","","14%","£7,260","£50,000 ","","","5"," 14%","Nottingham","EIS,SEIS","2","1","0","Order a Taxi is a mobile app service provider for taxi firms. We provide taxi firms with a full a mobile app presence for FREE and generate them an additional income stream as well as generating ourselves a commission. Our system uses the latest technologies to deliver GPS tracking, payment systems, and visually impressive full service mobile apps. An innovative, exciting, scalable business model with pre sign ups in a market worth over £4.3bn year. Read full pitch","http://www.crowdcube.com/files/pitch_pics/thumbs/200x150/2/1_473ab0ddbd4906c6c94fcea7070c6ccb.jpg"
"17","Bigfoot Education ","","","15%","£23,400","£150,000 ","","","38"," 15%","Islington, London","EIS,","8","7","0","Bigfoot Tutors is an online marketplace in the booming £6 billion private tuition market. Bigfoot aims to be the Amazon of online learning. Students can find tutors from around the world and have live lessons in a 1-2-1 online classroom. Students can profile tutors by skills, qualifications, experience, and user ratings/reviews. Customers can book a free 15 minute trial lesson. 85% of free trials convert to paid lessons on the website. Read full pitch","http://www.crowdcube.com/files/pitch_pics/thumbs/200x150/2/1_962fad6c82f7cac5596327eec1e98b2c.jpg"
"18","myBarrister ","","","12%","£19,060","£150,000 ","","","36"," 12%","London","EIS,SEIS","16","46","45","myBarrister exploits changes in the £23bn UK legal sector by enabling businesses and individuals to find and appoint a barrister to swiftly resolve their legal issues. With an intelligent website, a growing membership and a proven ability to attract clients, myBarrister has already earned over £100,000 income. They are now seeking funding to dramatically increase membership, boost marketing and accelerate towards an early exit. Read full pitch","http://www.crowdcube.com/files/pitch_pics/thumbs/200x150/2/1_05b8cdb2957995a5222c6ab6121470b5.jpg"
"19","Empiribox ","","","102%","£51,010","£50,000 ","","","31"," 100%","Barnet, London","EIS,SEIS","60","6","10","Empiribox is as an engaging way primary school children can learn science, as a form of hands-on learning and investigation! For teachers, it aims to be innovative and ground-breaking, integrating a novel approach to teaching support and learning, with access to the equipment needed to 'enthral' a classroom. Read full pitch","http://www.crowdcube.com/files/pitch_pics/thumbs/200x150/2/1_9d5b4bd9827d98661a564e096d6ae41d.jpg"
"20","HireJungle ","","","2%","£2,380","£100,000 ","","","32"," 6%","Greenwich, London","EIS,SEIS","0","0","0","HireJungle is UK's fastest growing peer to peer rental marketplace. Users can save money by hiring instead of buying stuff, or they can make money by hiring out spare goods commission-free. Read full pitch","http://www.crowdcube.com/files/pitch_pics/thumbs/200x150/2/1_6942656401f723bfe83636cba4aff30f.jpg"
"21","EMpak ","","","17%","£25,670","£150,000 ","","","25"," 17%","Tiverton, Devon","EIS,SEIS","2","12","0","EMpak have designed a one-shot medication delivery, which is suitable for pain relief, antihistamines, travel sickness, period pain, migraine and more. Designed to fit into a handbag, pocket, rucksack or glove compartment for use whilst out and about. Read full pitch","http://www.crowdcube.com/files/pitch_pics/thumbs/200x150/2/1_b752385955b29885629d95b6f96d19e2.jpg"
"22","BerryWhite ","","","47%","£143,390","£300,000 ","","","36"," 47%","City of Westminster, London","EIS,","23","0","0","BerryWhite® manufactures, markets and sells non-carbonated organic fruit drinks. BerryWhite organic drinks, already sold in 27 countries, has just confirmed that they are now due to be sold in 50 Waitrose stores around the UK to complement their presence on Ocado. Read full pitch","http://www.crowdcube.com/files/pitch_pics/thumbs/200x150/2/1_237727c639c978dc4f5e38611c8979ec.jpg"
"23","Fubar Radio ","","","40%","£60,020","£150,000 ","","","39"," 40%","Islington, London","EIS,","0","3","0","Fubar Radio is the UK’s first uncensored live comedy radio network with presenters including Justin Lee Collins, Richard Herring and Sean Hughes, available exclusively via a subscription based app. The Fubar Radio Network aims to create a new world of talk radio, comedy and music programming. Read full pitch","http://www.crowdcube.com/files/pitch_pics/thumbs/200x150/2/1_cf8c2fbdeb1db8cd73ec6a6ec3faacf7.jpg"
"24","Thor Drinks ","","","46%","£39,210","£85,000 ","","","11"," 46%","Enfield, London","EIS,SEIS","46","63","7"," Thor Drinks is a new range offering legendary refreshment to adults in bars, pubs and restaurants. We believe thatsweet and sickly soft drinks are monopolising the bar back fridges, and that Thor Drinks are challenging the old guard by capturing what we enjoy most in our favourite alcohol brands - crisp, dry flavours delivered with drama and passion.Read full pitch","http://www.crowdcube.com/files/pitch_pics/thumbs/200x150/2/1_80e0db01dab7fa260f86cde03b24a9c6.jpg"
"25","Blanco Nino ","","","183%","£110,160","£60,000 ","","","5"," 100%","Islington, London","EIS,SEIS","330","29","15","Blanco Niño, working directly with Irish farmers, aims to establish an authentic corn tortilla factory in Dublin Ireland. Producing unadulterated and sustainably produced corn tortillas, tortilla chips and masa haina for the European market.Read full pitch","http://www.crowdcube.com/files/pitch_pics/thumbs/200x150/2/1_06e20d11cfb80dfe53b427640b704914.jpg"
"26","The Shavedoctor ","","","1%","£820","£150,000 ","","","57"," 6%","Stafford, Staffordshire","EIS,","0","0","0","The Shavedoctor are a British shaving and skincare company that create and develop men's shaving and skincare products that target every day shaving issues like shaving rash, razor burn and even ingrown hairs. The Shavedoctor is headed by Mark Sproston, a grooming expert for men's magazines and tabloid newspapers who has recently become the 'Shave and Skincare Expert' for Loaded magazine and Modern Spa. Read full pitch","http://www.crowdcube.com/files/pitch_pics/thumbs/200x150/2/1_15a60810a4fb48d8981b1d75752c335f.jpg"
"27","Zero Carbon Food ","","","146%","£438,590","£300,000 ","","","13"," 100%","Wandsworth, London","EIS,","143","110","20","Backed by celebrity chef Michel Roux Jr and Florette’s Managing Director, Zero Carbon Food utilizes redundant underground spaces in London, producing leafy greens, herbs and micro greens using LED lights and hydroponics, producing fresh ingredients with a minimal carbon footprint. Read full pitch","http://www.crowdcube.com/files/pitch_pics/thumbs/200x150/2/1_fabe25f815ed604b3086479afb026d93.jpg"
"28","Plan Bee ","","","5%","£10,210","£175,000 ","","","50"," 8%","Wishaw, North Lanarkshire","EIS,","1","9","5","Plan Bee specialise in the establishment and management of beehives, providing our own brand of Corporate Social Sustainability to businesses. We are an award winning, EU commission recognised, micro international business that has already secured investment from Scottish Co Investment Bank. Our clients include Balfour Beatty and Highland Spring. Own a share of this honey-making, planet-saving, bee-boosting, profit with a purpose business. Read full pitch","http://www.crowdcube.com/files/pitch_pics/thumbs/200x150/2/1_ba3d09727681e25b6df73417e7a3e9de.jpg"
"29","Clear Water Revival ","","","115%","£184,930","£160,000 ","","","1"," 100%","Bristol, City of Bristol","EIS,","99","71","16","Clear Water Revival have been successfully designing and constructing chlorine free, natural swimming pools since 2006. They have developed a biological filtration technology that uses nature's processes, not chemicals to clean and sanitise swimming pool water. Their product aims to become the filtration system of choice in the swimming pool market. Read full pitch","http://www.crowdcube.com/files/pitch_pics/thumbs/200x150/2/1_046c106479765544096da8f48822cf7f.jpg"
"30","Paper Shooters ","","","9%","£7,420","£75,000 ","","","50"," 10%","Manchester","EIS,SEIS","9","3","0","PAPER SHOOTERS™ is a toy blaster construction kit which aims to revolutionise the toy blaster market. Our team includes an ex Nerf designer with the aim of revolutionising the toy blaster, targeting the huge global market that is ‘geeks and gamers.’ Following fantastic press coverage and social media presence, we are looking to explode into major retail stores in late 2014. Read full pitch","http://www.crowdcube.com/files/pitch_pics/thumbs/200x150/2/1_19a883271b06bb34285343cacae5ce1b.jpg"
"31","JewelStreet ","","","34%","£34,680","£100,000 ","","","44"," 34%","Bideford, Devon","EIS,","10","0","4","JewelStreet is the award winning online jewellery marketplace where designers and jewellery lovers meet. JewelStreet already boasts over 250 designers, an industry award and has secured a £138,000 grant. Read full pitch","http://www.crowdcube.com/files/pitch_pics/thumbs/200x150/2/1_a50da2e2becf715f64c987a76f7e5e2f.jpg"
"32","Stickyboard ","","","26%","£13,070","£50,000 ","","","57"," 26%","Greenwich, London","EIS,","2","20","0","Stickyboard is the the 'UK's Village Noticeboard.' Covering over 1.6 million postcodes and hosting over 150,000 local listings. Stickyboard aim to become the technology platform of choice for engaging local people and working with organisations from local charities to housing associations and councils in a market with current spend available for services relevant to their sector purported to be worth £18.7 billion per year Read full pitch","http://www.crowdcube.com/files/pitch_pics/thumbs/200x150/2/1_219c91b06372bcacc04865861ebe78de.jpg"
"33","SimpleeHost ","","","18%","£27,510","£150,000 ","","","42"," 18%","Camden, London","SEIS,","110","13","86","SimpleeHost is an online marketplace connecting consumers with private chefs for in-home dining experiences. You can browse, book and pay for a chef online to come to your home, prepare a delicious meal and do all the washing up so you can focus on your guests. Their aim is to make in home chefs more accessible and make the process more efficient for chefs and consumers alike. Read full pitch","http://www.crowdcube.com/files/pitch_pics/thumbs/200x150/2/1_234a0a4d4f22f5b6f8481795b3817c9b.jpg"
"34","nibnibs ","","","4%","£6,300","£150,000 ","","","52"," 8%","Ripon, North Yorkshire","EIS,SEIS","11","1","0","nibnibs is a stylish range of premium nibbles manufactured in their bakery in Ripon. Available throughout the UK in a wide range of Independent deli/farmshops and quality retail outlets such as Whole Foods Market and also in Hampers including Virginia Hayward and John Lewis. Read full pitch","http://www.crowdcube.com/files/pitch_pics/thumbs/200x150/2/1_c349e11d7ed9fa5b8f5cf84fead0a585.jpg"
"35","Enistic ","","","102%","£128,250","£125,000 ","","","40"," 100%","Oxford, Oxfordshire","EIS,","4","7","58","Rising energy costs and government efficiency compliance requirements have increased demand for Enistic’s innovative energy saving technology. Established in 2009, Enistic has designed and installed energy saving systems in companies throughout the world. Pret a Manger, Airtricity, Honda, Fujitsu & Cambridge University to name a few have benefitted from energy cost reduction, improved environmental credentials and regulatory compliance. Read full pitch","http://www.crowdcube.com/files/pitch_pics/thumbs/200x150/2/1_78f1fe755c3e938162d9ce78275c0467.jpg"
"36","Solar 350 ","","","15%","£19,680","£125,000 ","","","15"," 15%","City of Westminster, London","EIS,SEIS","5","69","1","Solar 350 is a developer of large scale solar parks in locations that are deemed most suitable to the technology to generate the best possible financial returns. This is based on high levels of solar irradiation, electricity prices and levels of subsidy along with low land, labour and development costs. Solar 350 aims to provide the most Commercial Solutions to Climate Change. Read full pitch","http://www.crowdcube.com/files/pitch_pics/thumbs/200x150/2/1_674a6e58fba65fc28d3af3554b4d5cee.jpg"
"37","Peer Contract ","","","4%","£2,510","£60,000 ","","","57"," 8%","Sandridge, Hertfordshire","EIS,","12","1","0","Peer Contract aims to be the first online peer to peer funding platform connecting investors from the general public to subcontractors and suppliers in the construction industry, creating mutually beneficial business partnerships. Read full pitch","http://www.crowdcube.com/files/pitch_pics/thumbs/200x150/2/1_2c7c7983b7f536d4bb9819785243c091.jpg"
"38","BuyMyWardrobe ","","","6%","£10,010","£150,000 ","","","57"," 10%","City of Westminster, London","EIS,","0","1","1","BuyMyWardrobe is a peer-to-peer social marketplace for pre-owned fashion. Launched in August 2012 and backed by high calibre investors including Carmen Busquets (the founding investor behind Net-A-Porter), the BuyMyWardrobe community now numbers more than 70,000 registered users and is growing fast. Origins of the business run deep within the London fashion community and is now an exciting online destination to buy and sell pre-owned fashion. Read full pitch","http://www.crowdcube.com/files/pitch_pics/thumbs/200x150/2/1_2bc374b4996ae90cf1117310977936cd.jpg"
"39","Sust-it ","","","7%","£11,010","£150,000 ","","","52"," 10%","Gloucestershire","EIS,","17","2","0","Sust-it is an energy efficiency comparison website for electrical appliances and products. It ranks products by their running costs and CO2 emissions based on average usage, and presents this information in financial terms to save customers money. Read full pitch","http://www.crowdcube.com/files/pitch_pics/thumbs/200x150/2/1_a8b3141938b15ab67f22f8093af1c13f.jpg"
"40","Skyrocket Phytopharma (UK) ","","","6%","£18,260","£300,000 ","","","49"," 10%","Brighton and Hove, East Sussex","EIS,SEIS","0","0","0","Skyrocket Phytopharma is UK-based, ethical pharmaceutical company specialising in phyto-(plant-derived) medicines. Their first product is a skin cream for the treatment of muscle pains, joint inflammation and sports injuries. Read full pitch","http://www.crowdcube.com/files/pitch_pics/thumbs/200x150/2/1_63154bae41de27e44ad9ba8ac2f48652.jpg"
"41","Bikini Fling ","","","20%","£12,020","£60,000 ","","","30"," 20%","City of Westminster, London","EIS,","15","19","20","Bikini Fling is a new British designer swimwear brand with ability to mix and match styles, sizes and colours to create a bespoke bikini. Bikini Fling is all about bold acts of confidence. They have had publicity in the likes of Vogue, Tatler, Red and Cosmopolitan. Read full pitch","http://www.crowdcube.com/files/pitch_pics/thumbs/200x150/2/1_7c2795c182f422ab6234e4e1cf586ac9.jpg"
"42","GolfPunk Media ","","","5%","£2,560","£50,000 ","","","46"," 8%","Haywards Heath, West Sussex","EIS,SEIS","20","5","3","GolfPunk is a multi-media golf magazine platform created by the multi award winning Editor of the Year and founder of Loaded Magazine, Tim Southwell, with Ryder Cup legend Sam Torrance as President. GolfPunk was created as an antidote to the traditional golf magazines in a publishing world shifting heavily towards digital. GolfPunk was recently shortlisted for Digital Product Of The Year at the Independent Publisher Awards. Read full pitch","http://www.crowdcube.com/files/pitch_pics/thumbs/200x150/2/1_4a09c7c1acd5b21a41480c361e204d1c.jpg"
"43","Convergent Home Technologies ","","","1%","£3,530","£200,000 ","","","19"," 6%","Chelmsford, Essex","EIS,","22","3","2","Convergent Home Technologies has created Dianemo- a solution that enables the home owner take control of everything in the home including lighting, heating, security and home entertainment in one system. Read full pitch","http://www.crowdcube.com/files/pitch_pics/thumbs/200x150/2/1_de1e24d4452c306afd9c048f88ab171e.jpg"
"44","The Cheesecake Emporium ","","","1%","£380","£50,000 ","","","32"," 6%","Lancashire","EIS,SEIS","1","2","11","The Cheesecake Emporium have created 'a fantastic looking chilled dessert' that they think offers consumers new flavours and taste experience. The Cheesecake Emporium are seeking a £50k investment to be used for Working Capital and Online Marketing. We hope investors will not only see the potential but taste it. Read full pitch","http://www.crowdcube.com/files/pitch_pics/thumbs/200x150/2/1_a3e9b5c23dd0d5b0204e2b132c0e2274.jpg"
"45","Giorry ","","","10%","£10,630","£100,000 ","","","38"," 10%","Wooburn Green, Buckinghamshire","EIS,","29","19","27","Yippydada is a brand that designs and sells 'stylish and cool' baby bags. Over 10 million babies are born every year in the US, Europe and Australia alone providing a vast target market. Read full pitch","http://www.crowdcube.com/files/pitch_pics/thumbs/200x150/2/1_ba1e0716b5617605fa53cfa9c64b90ee.jpg"
